{"head_sha":"2222222222222222222222222222222222222222","observations":[{"action":"resolved","evidence":[{"content_digest":"e096738f605d5f99cbfae7552a69276a395fa23d800932d48e01a54624b980c9","end_line":40,"excerpt":"one resolution vote","path":"src/auth.py","start_line":40}],"finding":{"category":"security","description":"The request reaches the protected operation without the required authorization check.","path":"src/auth.py","rule":"missing_authorization","severity":"important","symbol":"authorize","title":"Authorization can be bypassed"}}],"packet_digest":"034ce54dcce8c5090f1ce01c21c4304f47edbc2d43cce45f609acbd4990817e7","review_id":"07-split-resolution-carried","schema_version":"1.0.0","trial_number":1}
