{"head_sha":"2222222222222222222222222222222222222222","observations":[{"action":"active","evidence":[{"content_digest":"25bf9effaa046522c5b4cd2b31a89bbd58ae6683be6ae8a77064063dcdd0530f","end_line":11,"excerpt":"trial two blocker","path":"src/auth.py","start_line":11}],"finding":{"category":"security","description":"The request reaches the protected operation without the required authorization check.","path":"src/auth.py","rule":"missing_authorization","severity":"blocker","symbol":"authorize","title":"Authorization can be bypassed"}}],"packet_digest":"1909f94eb0921f3dc3dbd1f79946b9607716af386f531237f13132f28b4ea338","review_id":"02-consensus-blocker","schema_version":"1.0.0","trial_number":2}
